{
  "code": 0,
  "message": "ok",
  "data": {
    "refund_no": "ref_202604_001",
    "order_no": "ord_202604_002",
    "status": "completed",
    "requested_amount": "29.00",
    "approved_amount": "29.00",
    "currency": "CNY",
    "created_at": "2026-04-11T06:00:00.000Z",
    "finished_at": "2026-04-12T06:00:00.000Z",
    "timeline": [
      {
        "status": "pending_review",
        "at": "2026-04-11T06:00:00.000Z",
        "operator_type": "user",
        "note": "提交退款申请"
      },
      {
        "status": "completed",
        "at": "2026-04-12T06:00:00.000Z",
        "operator_type": "finance",
        "note": "原路退回成功"
      }
    ]
  },
  "request_id": "req_refund_detail_001",
  "timestamp": 1770000002000
}
